src/embeddedWebFonts/WebFonts.json

[
  {
    "name": "Abyssinica SIL 2-300",
    "id": "Abyssinica-SIL-2-300",
    "version": "2.300"
  },
  {
    "name": "Alkalami 3-000",
      "id": "Alkalami-3-000",
      "version": "3.000"
  },
  {
    "name": "Andika 7-000",
      "id": "Andika-7-000",
      "version": "7.000"
  },
  {
    "name": "Annapurna SIL 2-100",
      "id": "Annapurna-SIL-2-100",
      "version": "2.100"
  },
  {
    "name": "Awami Nastaliq 3-400",
    "id": "Awami-Nastaliq-3-400",
    "version": "3.300"
  },
  {
    "name": "Busra 9-000",
    "id": "Busra-9-000",
    "version": "9.000"
  },
  {
    "name": "Charis 7-000",
      "id": "charis-7-000",
      "version": "7.000"
  },
  {
    "name": "Doulos SIL 7-000",
      "id": "Doulos-SIL-7-000",
      "version": "7.000"
  },
  {
    "name": "Gentium 7-000",
      "id": "Gentium-7-000",
      "version": "7.000"
  },
  {
    "name": "Harmattan 4-300",
      "id": "Harmattan-4-300",
      "version": "4.300"
  },
  {
    "name": "Kanchenjunga 2-001",
      "id": "Kanchenjunga-2-001",
      "version": "2.001"
  },
  {
    "name": "Lateef 4-300",
      "id": "Lateef-4-300",
      "version": "4.300"
  },
  {
    "name": "Padauk 5-100",
      "id": "Padauk-5-100",
      "version": "5.100"
  },
  {
    "name": "Ruwudu 3-000",
      "id": "Ruwudu-3-000",
      "version": "3.000"
  },
  {
    "name": "Scheherazade New 4-300",
      "id": "Scheherazade-New-4-300",
      "version": "4.300"
  },
  {
    "name": "Tagmukay 2-000",
    "id": "Tagmukay-2-000",
    "version": "2.000"
  }
]

src/hooks/useDetectRender/useDetectRender.md

For example:
- Abyssinica SIL 2.300, Padauk 5.001, or Padauk 5.100 will return either 'RenderingGraphite' or 'RenderingOpenType, indicating how it has rendered as viewed.
- Alkalami 3.000, Harmattan 4.300, Lateef 4.300, Ruwudu 3.000, or Scheherazade New 4.300 will return "RenderingOpenType".
- Annapurana SIL 2.100 and Busra 9.000 will return "RenderingUnknown".
- Awami Nastliq 3.300 will return either 'RenderingGraphite' or 'RenderingUnknown.
    - Awami Nastliq does not display properly without Graphite.
    - *If it is known for certain that Awami Nastliq 3.300 is available (e.g., a webfont), then this can be used as a test to identify whether or not rendering is being handled by Graphite in cases other than Firefox, or could be used to identify if Graphite is disabled in Firefox config.*